<?xml version="1.0" encoding="UTF-8"?>
<text xmlns:xsi="http://www.w3.org/2001/XMLSchema-instance" xsi:noNamespaceSchemaLocation="../../meta/schema.xsd">

<sentence>
  <token value="Бойове" lemma="бойовий" tags="adj:n:v_naz:compb" />
  <token value="мистецтво" lemma="мистецтво" tags="noun:inanim:n:v_naz" />
  <token value="в" lemma="в" tags="prep" />
  <token value="маси" lemma="маса" tags="noun:inanim:p:v_zna" />
  <token value="." lemma="." tags="punct" />
</sentence>
<sentence>
  <token value="У" lemma="у" tags="prep" />
  <token value="Черкасах" lemma="Черкаси" tags="noun:inanim:p:v_mis:ns:prop:geo" />
  <token value="фестивалили" lemma="фестивалити" tags="verb:imperf:past:p" />
  <token value="спортсмени-каратисти" lemma="спортсмен-каратист" tags="noun:anim:p:v_naz" />
  <token value="." lemma="." tags="punct" />
</sentence>
<sentence>
  <token value="Такий" lemma="такий" tags="adj:m:v_zna:rinanim:pron:dem" />
  <token value="захід" lemma="захід" tags="noun:inanim:m:v_zna" />
  <token value="проводять" lemma="проводити" tags="verb:imperf:pres:p:3" />
  <token value="уперше" lemma="уперше" tags="adv" />
  <token value="." lemma="." tags="punct" />
</sentence>
<sentence>
  <token value="Усе" lemma="усе" tags="noun:inanim:n:v_naz:pron:gen" />
  <token value="–" lemma="–" tags="punct" />
  <token value="аби" lemma="аби" tags="conj:subord" />
  <token value="привабити" lemma="привабити" tags="verb:perf:inf" />
  <token value="до" lemma="до" tags="prep" />
  <token value="бойових" lemma="бойовий" tags="adj:p:v_rod:compb" />
  <token value="мистецтв" lemma="мистецтво" tags="noun:inanim:p:v_rod" />
  <token value="молодь" lemma="молодь" tags="noun:inanim:f:v_zna" />
  <token value="та" lemma="та" tags="conj:coord" />
  <token value="заохотити" lemma="заохотити" tags="verb:perf:inf" />
  <token value="до" lemma="до" tags="prep" />
  <token value="спорту" lemma="спорт" tags="noun:inanim:m:v_rod" />
  <token value="." lemma="." tags="punct" />
</sentence>
<sentence>
  <token value="Організували" lemma="організувати" tags="verb:perf:past:p" />
  <token value="захід" lemma="захід" tags="noun:inanim:m:v_zna" />
  <token value="обласний" lemma="обласний" tags="adj:m:v_naz" />
  <token value="центр" lemma="центр" tags="noun:inanim:m:v_naz:xp2" />
  <token value="«" lemma="«" tags="punct" />
  <token value="Спорт" lemma="спорт" tags="noun:inanim:m:v_naz" />
  <token value="для" lemma="для" tags="prep" />
  <token value="всіх" lemma="весь" tags="adj:p:v_rod:pron:gen" />
  <token value="»" lemma="»" tags="punct" />
  <token value="та" lemma="та" tags="conj:coord" />
  <token value="«" lemma="«" tags="punct" />
  <token value="Федерація" lemma="федерація" tags="noun:inanim:f:v_naz" />
  <token value="фунакоші" lemma="фунакоші" tags="noninfl:foreign" />
  <token value="шотокан" lemma="шотокан" tags="noninfl:foreign" />
  <token value="карате" lemma="карате" tags="noun:inanim:n:v_naz:nv" />
  <token value="України" lemma="Україна" tags="noun:inanim:f:v_rod:prop:geo" />
  <token value="»" lemma="»" tags="punct" />
  <token value="." lemma="." tags="punct" />
</sentence>
<sentence>
  <token value="Показати" lemma="показати" tags="verb:perf:inf" />
  <token value="свої" lemma="свій" tags="adj:p:v_zna:rinanim:pron:pos" />
  <token value="уміння" lemma="уміння" tags="noun:inanim:p:v_zna" />
  <token value="зголосилося" lemma="зголоситися" tags="verb:rev:perf:past:n" />
  <token value="більше" lemma="більше" tags="adv:compc:predic" />
  <token value="півсотні" lemma="півсотні" tags="noun:inanim:p:v_rod:nv:alt" />
  <token value="спортсменів" lemma="спортсмен" tags="noun:anim:p:v_rod" />
  <token value="." lemma="." tags="punct" />
</sentence>
<sentence>
  <token value="Усі" lemma="увесь" tags="adj:p:v_naz:pron:gen" />
  <token value="–" lemma="–" tags="punct" />
  <token value="вихованці" lemma="вихованець" tags="noun:anim:p:v_naz" />
  <token value="чотирьох" lemma="чотири" tags="numr:p:v_rod" />
  <token value="клубів" lemma="клуб" tags="noun:inanim:p:v_rod:xp2" />
  <token value="з" lemma="з" tags="prep" />
  <token value="Черкащини" lemma="Черкащина" tags="noun:inanim:f:v_rod:prop:geo" />
  <token value="." lemma="." tags="punct" />
</sentence>
<sentence>
  <token value="Між" lemma="між" tags="prep" />
  <token value="собою" lemma="себе" tags="noun:unanim:s:v_oru:pron:refl" />
  <token value="змагалися" lemma="змагатися" tags="verb:rev:imperf:past:p" />
  <token value="за" lemma="за" tags="prep" />
  <token value="звання" lemma="звання" tags="noun:inanim:n:v_zna" />
  <token value="найсильнішого" lemma="найсильніший" tags="adj:m:v_rod:comps" />
  <token value="," lemma="," tags="punct" />
  <token value="а" lemma="а" tags="conj:coord" />
  <token value="для" lemma="для" tags="prep" />
  <token value="глядачів" lemma="глядач" tags="noun:anim:p:v_rod" />
  <token value="презентували" lemma="презентувати" tags="verb:perf:past:p" />
  <token value="ще" lemma="ще" tags="adv" />
  <token value="й" lemma="й" tags="part" />
  <token value="показові" lemma="показовий" tags="adj:p:v_zna:rinanim:compb" />
  <token value="виступи" lemma="виступ" tags="noun:inanim:p:v_zna" />
  <token value="." lemma="." tags="punct" />
</sentence>
<paragraph/>

<sentence>
  <token value="Анатолій" lemma="Анатолій" tags="noun:anim:m:v_naz:prop:fname" />
  <token value="Науменко" lemma="Науменко" tags="noun:anim:m:v_naz:prop:lname" />
  <token value="," lemma="," tags="punct" />
  <token value="президент" lemma="президент" tags="noun:anim:m:v_naz" />
  <token value="«" lemma="«" tags="punct" />
  <token value="Федерації" lemma="федерація" tags="noun:inanim:p:v_naz" />
  <token value="фунакоші" lemma="фунакіш" tags="noninfl:foreign" />
  <token value="шотокан" lemma="шотокан" tags="noninfl:foreign" />
  <token value="карате" lemma="карате" tags="noun:inanim:n:v_naz:nv" />
  <token value="України" lemma="Україна" tags="noun:inanim:f:v_rod:prop:geo" />
  <token value="»" lemma="»" tags="punct" />
  <token value=":" lemma=":" tags="punct" />
  <token value="«" lemma="«" tags="punct" />
  <token value="Важливим" lemma="важливий" tags="adj:n:v_oru:compb" />
  <token value="на" lemma="на" tags="prep" />
  <token value="сьогодні" lemma="сьогодні" tags="adv" />
  <token value="є" lemma="бути" tags="verb:imperf:pres:s:3" />
  <token value="заняття" lemma="заняття" tags="noun:inanim:n:v_naz" />
  <token value="масовим" lemma="масовий" tags="adj:m:v_oru:compb" />
  <token value="спортом" lemma="спорт" tags="noun:inanim:m:v_oru" />
  <token value="." lemma="." tags="punct" />
</sentence>
<sentence>
  <token value="От" lemma="от" tags="part" />
  <token value="якраз" lemma="якраз" tags="adv" />
  <token value="бойові" lemma="бойовий" tags="adj:p:v_naz:compb" />
  <token value="мистецтва" lemma="мистецтво" tags="noun:inanim:p:v_naz" />
  <token value="набирають" lemma="набирати" tags="verb:imperf:pres:p:3" />
  <token value="дуже" lemma="дуже" tags="adv:compb" />
  <token value="серйозні" lemma="серйозний" tags="adj:p:v_zna:rinanim:compb" />
  <token value="оберти" lemma="оберт" tags="noun:inanim:p:v_zna" />
  <token value="останнім" lemma="останній" tags="adj:m:v_oru:compb" />
  <token value="часом" lemma="час" tags="noun:inanim:m:v_oru" />
  <token value="." lemma="." tags="punct" />
</sentence>
<sentence>
  <token value="І" lemma="і" tags="conj:coord" />
  <token value="ми" lemma="ми" tags="noun:anim:p:v_naz:pron:pers:1" />
  <token value="бачимо" lemma="бачити" tags="verb:imperf:pres:p:1" />
  <token value="," lemma="," tags="punct" />
  <token value="справді" lemma="справді" tags="adv:insert" />
  <token value="," lemma="," tags="punct" />
  <token value="велику" lemma="великий" tags="adj:f:v_zna:compb" />
  <token value="армію" lemma="армія" tags="noun:inanim:f:v_zna" />
  <token value="прихильників" lemma="прихильник" tags="noun:anim:p:v_rod" />
  <token value="нашого" lemma="наш" tags="adj:m:v_rod:pron:pos" />
  <token value="виду" lemma="вид" tags="noun:inanim:m:v_rod" />
  <token value="спорту" lemma="спорт" tags="noun:inanim:m:v_rod" />
  <token value="»" lemma="»" tags="punct" />
  <token value="." lemma="." tags="punct" />
</sentence>

</text>
