<?xml version="1.0" encoding="UTF-8"?>
<text xmlns:xsi="http://www.w3.org/2001/XMLSchema-instance" xsi:noNamespaceSchemaLocation="../../meta/schema.xsd">

<sentence>
  <token value="Служба" lemma="служба" tags="noun:inanim:f:v_naz" />
  <token value="автомобільних" lemma="автомобільний" tags="adj:p:v_rod" />
  <token value="доріг" lemma="дорога" tags="noun:inanim:p:v_rod" />
  <token value="у" lemma="у" tags="prep" />
  <token value="Хмельницькій" lemma="хмельницький" tags="adj:f:v_mis" />
  <token value="області" lemma="область" tags="noun:inanim:f:v_mis" />
  <token value="планує" lemma="планувати" tags="verb:imperf:pres:s:3" />
  <token value="відремонтувати" lemma="відремонтувати" tags="verb:perf:inf" />
  <token value="три" lemma="три" tags="numr:p:v_zna" />
  <token value="мости" lemma="міст" tags="noun:inanim:p:v_zna" />
  <token value="у" lemma="у" tags="prep" />
  <token value="Дунаєвецькому" lemma="дунаєвецький" tags="adj:m:v_mis" />
  <token value="і" lemma="і" tags="conj:coord" />
  <token value="Полонському" lemma="полонський" tags="adj:m:v_mis" />
  <token value="районах" lemma="район" tags="noun:inanim:p:v_mis" />
  <token value="." lemma="." tags="punct" />
</sentence>
<sentence>
  <token value="Про" lemma="про" tags="prep" />
  <token value="це" lemma="це" tags="noun:inanim:n:v_zna:pron:dem" />
  <token value="повідомляють" lemma="повідомляти" tags="verb:imperf:pres:p:3" />
  <token value="у" lemma="у" tags="prep" />
  <token value="прес-службі" lemma="прес-служба" tags="noun:inanim:f:v_mis:alt" />
  <token value="відомства" lemma="відомство" tags="noun:inanim:n:v_rod" />
  <token value="." lemma="." tags="punct" />
</sentence>
<paragraph/>

<sentence>
  <token value="Оголошення" lemma="оголошення" tags="noun:inanim:n:v_zna" />
  <token value="про" lemma="про" tags="prep" />
  <token value="проведення" lemma="проведення" tags="noun:inanim:n:v_zna" />
  <token value="відкритих" lemma="відкритий" tags="adj:p:v_rod:adjp:pasv:perf:compb" />
  <token value="торгів" lemma="торг" tags="noun:inanim:p:v_rod" />
  <token value="щодо" lemma="щодо" tags="prep" />
  <token value="закупівлі" lemma="закупівля" tags="noun:inanim:f:v_rod" />
  <token value="послуг" lemma="послуга" tags="noun:inanim:p:v_rod" />
  <token value="на" lemma="на" tags="prep" />
  <token value="проведення" lemma="проведення" tags="noun:inanim:n:v_zna" />
  <token value="аварійних" lemma="аварійний" tags="adj:p:v_rod:compb" />
  <token value="робіт" lemma="робота" tags="noun:inanim:p:v_rod" />
  <token value="із" lemma="із" tags="prep" />
  <token value="ліквідації" lemma="ліквідація" tags="noun:inanim:f:v_rod" />
  <token value="окремих" lemma="окремий" tags="adj:p:v_rod" />
  <token value="пошкоджень" lemma="пошкодження" tags="noun:inanim:p:v_rod" />
  <token value="елементів" lemma="елемент" tags="noun:inanim:p:v_rod" />
  <token value="мостів" lemma="міст" tags="noun:inanim:p:v_rod" />
  <token value="Служба" lemma="служба" tags="noun:inanim:f:v_naz" />
  <token value="автомобільних" lemma="автомобільний" tags="adj:p:v_rod" />
  <token value="доріг" lemma="дорога" tags="noun:inanim:p:v_rod" />
  <token value="у" lemma="у" tags="prep" />
  <token value="Хмельницькій" lemma="хмельницький" tags="adj:f:v_mis" />
  <token value="області" lemma="область" tags="noun:inanim:f:v_mis" />
  <token value="розмістила" lemma="розмістити" tags="verb:perf:past:f" />
  <token value="11" lemma="11" tags="number" />
  <token value="травня" lemma="травень" tags="noun:inanim:m:v_rod" />
  <token value="у" lemma="у" tags="prep" />
  <token value="системі" lemma="система" tags="noun:inanim:f:v_mis" />
  <token value="публічних" lemma="публічний" tags="adj:p:v_rod:compb" />
  <token value="закупівель" lemma="закупівля" tags="noun:inanim:p:v_rod" />
  <token value="«" lemma="«" tags="punct" />
  <token value="Prozorro" lemma="Prozorro" tags="unclass" />
  <token value="»" lemma="»" tags="punct" />
  <token value="." lemma="." tags="punct" />
</sentence>
<paragraph/>

<sentence>
  <token value="Відремонтувати" lemma="відремонтувати" tags="verb:perf:inf" />
  <token value="мають" lemma="мати" tags="verb:imperf:pres:p:3" />
  <token value="мости" lemma="міст" tags="noun:inanim:p:v_zna" />
  <token value="через" lemma="через" tags="prep" />
  <token value="річки" lemma="річка" tags="noun:inanim:p:v_zna" />
  <token value="Деревичка" lemma="Деревичка" tags="noun:inanim:f:v_naz:prop:geo" />
  <token value="і" lemma="і" tags="conj:coord" />
  <token value="Прислуч" lemma="Прислуч" tags="noun:inanim:f:v_naz:prop:geo" />
  <token value="у" lemma="у" tags="prep" />
  <token value="Полонському" lemma="полонський" tags="adj:m:v_mis" />
  <token value="районі" lemma="район" tags="noun:inanim:m:v_mis" />
  <token value="," lemma="," tags="punct" />
  <token value="та" lemma="та" tags="conj:coord" />
  <token value="Смотрич" lemma="Смотрич" tags="noun:inanim:m:v_zna:prop:geo" />
  <token value="у" lemma="у" tags="prep" />
  <token value="Дунаєвецькому" lemma="дунаєвецький" tags="adj:m:v_mis" />
  <token value="районі" lemma="район" tags="noun:inanim:m:v_mis" />
  <token value="." lemma="." tags="punct" />
</sentence>
<sentence>
  <token value="Очікувана" lemma="очікуваний" tags="adj:f:v_naz:adjp:pasv:imperf:compb" />
  <token value="вартість" lemma="вартість" tags="noun:inanim:f:v_naz" />
  <token value="предметів" lemma="предмет" tags="noun:inanim:p:v_rod" />
  <token value="закупівель" lemma="закупівля" tags="noun:inanim:p:v_rod" />
  <token value="становить" lemma="становити" tags="verb:imperf:pres:s:3" />
  <token value=":" lemma=":" tags="punct" />
  <token value="625" lemma="625" tags="number" />
  <token value="тисяч" lemma="тисяча" tags="noun:inanim:p:v_rod:numr" />
  <token value="776" lemma="776" tags="number" />
  <token value="гривень" lemma="гривня" tags="noun:inanim:p:v_rod" />
  <token value="," lemma="," tags="punct" />
  <token value="1" lemma="1" tags="number" />
  <token value="мільйон" lemma="мільйон" tags="noun:inanim:m:v_zna:numr" />
  <token value="254" lemma="254" tags="number" />
  <token value="тисяч" lemma="тисяча" tags="noun:inanim:p:v_rod:numr:subst" comment="тисячі" />
  <token value="гривень" lemma="гривня" tags="noun:inanim:p:v_rod" />
  <token value="та" lemma="та" tags="conj:coord" />
  <token value="392" lemma="392" tags="number" />
  <token value="тисяч" lemma="тисяча" tags="noun:inanim:p:v_rod:numr:subst" comment="тисячі" />
  <token value="470" lemma="470" tags="number" />
  <token value="гривень" lemma="гривня" tags="noun:inanim:p:v_rod" />
  <token value="." lemma="." tags="punct" />
</sentence>
<sentence>
  <token value="Загальна" lemma="загальний" tags="adj:f:v_naz:compb" />
  <token value="вартість" lemma="вартість" tags="noun:inanim:f:v_naz" />
  <token value="–" lemma="–" tags="punct" />
  <token value="майже" lemma="майже" tags="adv" />
  <token value="2" lemma="2" tags="number" />
  <token value="мільйони" lemma="мільйон" tags="noun:inanim:p:v_naz:numr" />
  <token value="300" lemma="300" tags="number" />
  <token value="тисяч" lemma="тисяча" tags="noun:inanim:p:v_rod:numr" />
  <token value="гривень" lemma="гривня" tags="noun:inanim:p:v_rod" />
  <token value="." lemma="." tags="punct" />
</sentence>

</text>
